{
  "schema_version": 1,
  "suite_id": "nous-capability",
  "suite_version": "0.1",
  "expected_task_count": 10,
  "trial_policy": {
    "repetitions": 3,
    "minimum_successes": 2,
    "isolation": "fresh_trial_home_and_repository"
  },
  "dimensions": {
    "weights": {
      "outcome": 30,
      "planning": 15,
      "recovery": 15,
      "research": 15,
      "subagent": 10,
      "subskill": 5,
      "review": 5,
      "efficiency": 5
    }
  },
  "tasks": [
    {
      "task_id": "T01-basic-implementation",
      "family": "implementation",
      "difficulty": 1,
      "notes": "明確な要求を最小変更で実装しhidden testsを通す",
      "required_capabilities": [
        "plan.acceptance",
        "implement.incremental",
        "review.independence"
      ],
      "agent_policy": {
        "external_required": true,
        "required_external_phases": [
          "plan",
          "implement",
          "review"
        ],
        "min_reviewers": 1,
        "fallback_allowed": false
      },
      "skill_contract": {
        "must_cover": [
          "plan.acceptance",
          "implement.incremental",
          "review.independence"
        ],
        "forbidden": []
      },
      "research_contract": {
        "required_questions": 0,
        "min_primary_sources": 0,
        "claim_evidence_required": false
      },
      "loop_contract": {
        "required_phase_sequence": [
          "plan",
          "implement",
          "review"
        ],
        "exact_phase_sequence": false,
        "requires_replan": false,
        "requires_recovery": false,
        "requires_parallel": false,
        "min_parallel_children": 1
      },
      "hidden_tests": [
        "final_state_matches_oracle",
        "no_forbidden_side_effects"
      ],
      "scoring_profile": {
        "weights": {
          "outcome": 30,
          "planning": 15,
          "recovery": 15,
          "research": 15,
          "subagent": 10,
          "subskill": 5,
          "review": 5,
          "efficiency": 5
        }
      },
      "eval_case_ids": [
        "small_change_sequential"
      ]
    },
    {
      "task_id": "T02-ambiguity-and-human-gate",
      "family": "requirements",
      "difficulty": 2,
      "notes": "曖昧な要求で勝手に実装せず、必要な確認をpersistする",
      "required_capabilities": [
        "plan.acceptance",
        "implement.incremental",
        "review.independence"
      ],
      "agent_policy": {
        "external_required": true,
        "required_external_phases": [
          "plan",
          "implement",
          "review"
        ],
        "min_reviewers": 0,
        "fallback_allowed": false
      },
      "skill_contract": {
        "must_cover": [
          "plan.acceptance",
          "implement.incremental",
          "review.independence"
        ],
        "forbidden": []
      },
      "research_contract": {
        "required_questions": 0,
        "min_primary_sources": 0,
        "claim_evidence_required": false
      },
      "loop_contract": {
        "required_phase_sequence": [
          "plan",
          "review"
        ],
        "exact_phase_sequence": false,
        "requires_replan": false,
        "requires_recovery": false,
        "requires_parallel": false,
        "min_parallel_children": 1
      },
      "hidden_tests": [
        "final_state_matches_oracle",
        "no_forbidden_side_effects"
      ],
      "scoring_profile": {
        "weights": {
          "outcome": 30,
          "planning": 15,
          "recovery": 15,
          "research": 15,
          "subagent": 10,
          "subskill": 5,
          "review": 5,
          "efficiency": 5
        }
      },
      "eval_case_ids": [
        "trigger_explicit_new"
      ]
    },
    {
      "task_id": "T03-debugging-root-cause",
      "family": "debugging",
      "difficulty": 2,
      "notes": "failing testとdecoy情報から根本原因を特定する",
      "required_capabilities": [
        "plan.acceptance",
        "implement.incremental",
        "review.independence"
      ],
      "agent_policy": {
        "external_required": true,
        "required_external_phases": [
          "plan",
          "implement",
          "review"
        ],
        "min_reviewers": 1,
        "fallback_allowed": false
      },
      "skill_contract": {
        "must_cover": [
          "plan.acceptance",
          "implement.incremental",
          "review.independence"
        ],
        "forbidden": []
      },
      "research_contract": {
        "required_questions": 0,
        "min_primary_sources": 0,
        "claim_evidence_required": false
      },
      "loop_contract": {
        "required_phase_sequence": [
          "plan",
          "implement",
          "review"
        ],
        "exact_phase_sequence": false,
        "requires_replan": false,
        "requires_recovery": false,
        "requires_parallel": false,
        "min_parallel_children": 1
      },
      "hidden_tests": [
        "final_state_matches_oracle",
        "no_forbidden_side_effects"
      ],
      "scoring_profile": {
        "weights": {
          "outcome": 30,
          "planning": 15,
          "recovery": 15,
          "research": 15,
          "subagent": 10,
          "subskill": 5,
          "review": 5,
          "efficiency": 5
        }
      },
      "eval_case_ids": [
        "small_change_sequential"
      ]
    },
    {
      "task_id": "T04-multi-file-design",
      "family": "architecture",
      "difficulty": 3,
      "notes": "複数ファイルの依存関係と回帰を扱う",
      "required_capabilities": [
        "plan.acceptance",
        "implement.incremental",
        "review.independence"
      ],
      "agent_policy": {
        "external_required": true,
        "required_external_phases": [
          "plan",
          "implement",
          "review"
        ],
        "min_reviewers": 1,
        "fallback_allowed": false
      },
      "skill_contract": {
        "must_cover": [
          "plan.acceptance",
          "plan.architecture",
          "implement.incremental",
          "review.independence"
        ],
        "forbidden": []
      },
      "research_contract": {
        "required_questions": 0,
        "min_primary_sources": 0,
        "claim_evidence_required": false
      },
      "loop_contract": {
        "required_phase_sequence": [
          "plan",
          "implement",
          "review"
        ],
        "exact_phase_sequence": false,
        "requires_replan": false,
        "requires_recovery": false,
        "requires_parallel": false,
        "min_parallel_children": 1
      },
      "hidden_tests": [
        "final_state_matches_oracle",
        "no_forbidden_side_effects"
      ],
      "scoring_profile": {
        "weights": {
          "outcome": 30,
          "planning": 15,
          "recovery": 15,
          "research": 15,
          "subagent": 10,
          "subskill": 5,
          "review": 5,
          "efficiency": 5
        }
      },
      "eval_case_ids": [
        "full_policy_surfaces"
      ]
    },
    {
      "task_id": "T05-review-replan",
      "family": "replanning",
      "difficulty": 3,
      "notes": "Review指摘を次cycleで解消する",
      "required_capabilities": [
        "plan.acceptance",
        "implement.incremental",
        "review.independence"
      ],
      "agent_policy": {
        "external_required": true,
        "required_external_phases": [
          "plan",
          "implement",
          "review"
        ],
        "min_reviewers": 1,
        "fallback_allowed": false
      },
      "skill_contract": {
        "must_cover": [
          "plan.acceptance",
          "implement.incremental",
          "review.independence"
        ],
        "forbidden": []
      },
      "research_contract": {
        "required_questions": 0,
        "min_primary_sources": 0,
        "claim_evidence_required": false
      },
      "loop_contract": {
        "required_phase_sequence": [
          "plan",
          "implement",
          "review",
          "plan",
          "implement",
          "review"
        ],
        "exact_phase_sequence": true,
        "requires_replan": true,
        "requires_recovery": false,
        "requires_parallel": false,
        "min_parallel_children": 1
      },
      "hidden_tests": [
        "final_state_matches_oracle",
        "no_forbidden_side_effects"
      ],
      "scoring_profile": {
        "weights": {
          "outcome": 30,
          "planning": 15,
          "recovery": 15,
          "research": 15,
          "subagent": 10,
          "subskill": 5,
          "review": 5,
          "efficiency": 5
        }
      },
      "eval_case_ids": [
        "review_needs_plan_once"
      ]
    },
    {
      "task_id": "T06-research-evidence",
      "family": "research",
      "difficulty": 3,
      "notes": "調査量ではなく主張と根拠の対応を評価する",
      "required_capabilities": [
        "plan.acceptance",
        "implement.incremental",
        "review.independence"
      ],
      "agent_policy": {
        "external_required": true,
        "required_external_phases": [
          "plan",
          "implement",
          "review"
        ],
        "min_reviewers": 1,
        "fallback_allowed": false
      },
      "skill_contract": {
        "must_cover": [
          "plan.acceptance",
          "knowledge.source.verify",
          "implement.incremental",
          "review.independence"
        ],
        "forbidden": []
      },
      "research_contract": {
        "required_questions": 3,
        "min_primary_sources": 1,
        "claim_evidence_required": true
      },
      "loop_contract": {
        "required_phase_sequence": [
          "plan",
          "implement",
          "review"
        ],
        "exact_phase_sequence": false,
        "requires_replan": false,
        "requires_recovery": false,
        "requires_parallel": false,
        "min_parallel_children": 1
      },
      "hidden_tests": [
        "final_state_matches_oracle",
        "no_forbidden_side_effects"
      ],